ID	QUESTION	ANSWER	CHOICES	gpt-4o	gpt-4o_maxd	gpt-4o_paths	mistral-large-latest	mistral-large-latest_maxd	mistral-large-latest_paths	claude-3-5-sonnet-20240620	claude-3-5-sonnet-20240620_maxd	claude-3-5-sonnet-20240620_paths
720	एतासु का आसीत् यस्याः उच्छिष्टानि बदरीफलानि श्रीरामेण खादितानि?	शबरी 	 अहल्या / अनसूया / शबरी / त्रिजटा	शबरी	1		शबरी	1	(:Tribe {'lemma': शबरी})<-[:IS_DIRECTED_TO]-({'lemma': राम})	शबर्याः	1	(:Tribe {'lemma': शबरी})<-[:IS_DIRECTED_TO]-({'lemma': राम}); (:Human {'lemma': राम})-[:IS_DIRECTED_TO]->({'lemma': शबरी})
721	आदिकविः एतेषु कः कथ्यते?	वाल्मीकिः	 वाल्मीकिः / भवभूतिः / विश्वामित्रः / तुलसीदासः	वाल्मीकिः	1		वाल्मीकिः	1		"उत्तरम्: वाल्मीकिः

वाल्मीकिः एव आदिकविः कथ्यते स रामायणस्य रचयिता आसीत्, यत् संस्कृत साहित्ये प्रथमम् महाकाव्यम् मन्यते अतः स आदिकविः इति प्रसिद्धः"	1	
722	एतेषु कस्य 'दशाननः' इति नाम आसीत्?	रावणस्य	 मेघनादस्य / विभीषणस्य / कुंभकर्णस्य / रावणस्य	रावणस्य	1	(:Rakshasa {'lemma': मेघनाद})-[:IS_SON_OF]->({'lemma': रावण}); (:Rakshasa {'lemma': रावण})<-[:IS_SON_OF]-({'lemma': मेघनाद})	रावणस्य	1	(:Rakshasa {'lemma': मेघनाद})-[:IS_SON_OF]->({'lemma': रावण})	रावणस्य	1	(:Rakshasa {'lemma': मेघनाद})-[:IS_SON_OF]->({'lemma': रावण}); (:Rakshasa {'lemma': रावण})<-[:IS_SON_OF]-({'lemma': मेघनाद})
723	एतासु अयोनिजा का आसीत्?	सीता	 कौसल्या / सीता / अहल्या / सुलोचना	सीता	1		सीता	1		"उत्तरम्: सीता

सीता अयोनिजा आसीत्, यतः सा भूमेः उत्पन्ना, न तु मातुः गर्भात् जनकराजेन हलकर्षणसमये भूमेः उत्थिता सा दृष्टा अतः सीता भूमिजा वा अयोनिजा इति कथ्यते"	1	
724	विदेहः एतेषु  कस्य नाम आसीत्?	जनकस्य	 दशरथस्य / विभीषणस्य / जनकस्य / शत्रुघ्नस्य	जनकस्य	1	(:Human {'lemma': दशरथ})-[:IS_KNOWN_AS]->({'lemma': दशरथ}); (:Epithet {'lemma': दशरथ})<-[:IS_KNOWN_AS]-({'lemma': दशरथ})	जनकस्य	1	(:Human {'lemma': दशरथ})<-[:IS_FATHER_OF]-({'lemma': अज}); (:Epithet {'lemma': दशरथ})-[:IS_FATHER_OF]->({'lemma': लक्ष्मण}); (:Epithet {'lemma': दशरथ})-[:IS_FATHER_OF]->({'lemma': राम})	जनकस्य	1	(:Human {'lemma': दशरथ})-[:IS_KNOWN_AS]->({'lemma': दशरथ}); (:Epithet {'lemma': दशरथ})<-[:IS_KNOWN_AS]-({'lemma': दशरथ})
725	एतेषु मुनिषु केन सह महर्षेः विश्वामित्रस्य भगिन्याः सत्यवत्याः विवाहः अभवत्?	ऋचीकेन	 वसिष्ठेण / ऋचीकेन / अत्रिना / भरद्वाजेन	ऋचीकेन	1	(:Human {'lemma': सत्यवती})-[:IS_SISTER_OF]->({'lemma': विश्वामित्र}); (:Rishi {'lemma': विश्वामित्र})<-[:IS_SISTER_OF]-({'lemma': सत्यवती}); (:Maharshi {'lemma': वसिष्ठ})<-[:IS_WIFE_OF]-({'lemma': अरुन्धती})	ऋचीकेन	1	(:Human {'lemma': सत्यवती})-[:IS_SISTER_OF]->({'lemma': विश्वामित्र}); (:Rishi {'lemma': विश्वामित्र})<-[:IS_SISTER_OF]-({'lemma': सत्यवती})	ऋचीकेन	1	(:Human {'lemma': सत्यवती})-[:IS_SISTER_OF]->({'lemma': विश्वामित्र}); (:Rishi {'lemma': विश्वामित्र})<-[:IS_SISTER_OF]-({'lemma': सत्यवती})
726	एतेषु कः गङ्गां पृथिव्यां आनयत्?	भगीरथः	 अंशुमान् / सगरः / असमञ्जः / भगीरथः	भगीरथः	1		भगीरथः	1		भगीरथः	1	(:River {'lemma': गङ्गा})-[:WAS_RELEASED_BY]->({'lemma': शङ्कर})
727	राजा दशरथस्य मन्त्री एतेषु कः आसीत्?	अकोपः	 सञ्जयः / अकोपः / शतानन्दः / सुग्रीवः	शतानन्दः	1		शतानन्दः	1		अकोपः	1	(:Human {'lemma': अकोप})-[:IS_A_CONUSELLOR_OF]->({'lemma': दशरथ}); (:Human {'lemma': दशरथ})<-[:IS_A_CONUSELLOR_OF]-({'lemma': अकोप}); (:Human {'lemma': दशरथ})<-[:IS_A_CONUSELLOR_OF]-({'lemma': धर्मपाल})
728	देवतानां सेनापति: एतेषु कः अभवत्?	कार्तिकेयः	 गणेशः / अर्जुनः / भगीरथः / कार्त्तिकेयः	कार्त्तिकेयः	1		कार्त्तिकेयः	1	(:King {'lemma': अर्जुन})-[:IS_KILLED_BY]->({'lemma': विष्णु}); (:King {'lemma': अर्जुन})<-[:IS_KILLED_BY]-({'lemma': जमदग्नि}); (:King {'lemma': अर्जुन})<-[:ANOTHER_NAME_OF]-({'lemma': कार्तवीर्य})	"उत्तरम्: कार्त्तिकेयः

देवतानां सेनापतिः कार्त्तिकेयः अभवत् कार्त्तिकेयः, यः स्कन्दः वा सुब्रह्मण्यः वा इति नाम्ना अपि ज्ञायते, हिन्दू धर्मे देवसेनायाः नायकः मन्यते"	1	
729	एतासु का राक्षसी राक्षसानां विनाशं श्रीरामस्य विजयं च स्वप्ने अद्राक्षीत्?	त्रिजटा	 त्रिजटा / सुरसा / ताटका / पूतना	त्रिजटा	1		त्रिजटा	1	(:Rakshashi {'lemma': त्रिजटा})<-[:IS_PLACED_BY]-({'lemma': सीता}); (:Rakshashi {'lemma': ताटका})-[:IS_WIFE_OF]->({'lemma': सुन्द}); (:Rakshashi {'lemma': ताटका})<-[:IS_SON_OF]-({'lemma': मारीच})	त्रिजटा	1	(:Rakshashi {'lemma': त्रिजटा})<-[:IS_PLACED_BY]-({'lemma': सीता})
730	एतेषु कस्य पुच्छे अग्निं आधाय राक्षसैः दण्डितं कृतम्?	हनुुमतः	 अङ्गदस्य / सुग्रीवस्य / नलस्य / हनुमतः	हनुमतः	1		हनुमतः	1		उत्तरम्: हनुमतः	1	
731	एतेषु कः 'वैष्णवधनुषः' निर्माणमकरोत्?	विश्वकर्मा	 विश्वकर्मा / मयः / इन्द्रः / शिवः	विश्वकर्मा	1	({'lemma': वैष्णवधनुस्}); ({'lemma': विश्वकर्मन्}); ({'lemma': मयस्})	विश्वकर्मा	1		उत्तरम्: विश्वकर्मणा	1	
732	एतेषु कः शिवधनुषः निर्माणमकरोत्?	विश्वकर्मा	 याज्ञवल्क्यः / परशुरामः / विश्वकर्मा / जनकः	विश्वकर्मा	1		परशुरामः	1	(:Rishi {'lemma': परशुराम})<-[:IS_FATHER_OF]-({'lemma': जमदग्नि})	"उत्तरम्: विश्वकर्मणा

शिवधनुषः निर्माणं विश्वकर्मणा कृतम् विश्वकर्मा देवानां शिल्पी आसीत्, यः अनेकानि दिव्यास्त्राणि निर्मितवान् तेषु शिवधनुरपि अन्यतमम् आसीत्"	1	
733	एतेषु श्रीरामचरितमानसस्य रचयिता कः?	तुलसीदासः	 वाल्मीकिः / तुलसीदासः / भवभूतिः / विश्वामित्रः	तुलसीदासः	1		तुलसीदासः	1	(:Maharshi {'lemma': वाल्मीकि})-[:TOOK_A_BATH_IN]->({'lemma': तमसा}); (:Maharshi {'lemma': वाल्मीकि})-[:FORESEEN_THE_DEATH_OF]->({'lemma': जटायु})	"उत्तरम्: तुलसीदासः

श्रीरामचरितमानसस्य रचयिता तुलसीदासः एव अयं ग्रन्थः अवधी भाषायां रचितः, यः रामायणस्य भक्तिपूर्णं पुनः कथनम् अस्ति"	1	
734	लक्ष्मणेन एतासु कस्याः राक्षस्याः नासिकाकर्णाः च छिन्नाः?	अयोमुख्याः	 लङ्किन्याः / अयोमुख्याः / प्रघसायाः / त्रिजटायाः	अयोमुख्याः	1	(:Human {'lemma': लक्ष्मण})<-[:IS_DISFIGURED_BY]-({'lemma': अयोमुखी})	शूर्पणखायाः	1		शूर्पणखायाः	1	(:Human {'lemma': लक्ष्मण})<-[:IS_DISFIGURED_BY]-({'lemma': अयोमुखी}); (:Rakshashi {'lemma': शूर्पणखा})-[:WAS_DISFIGURED_BY]->({'lemma': राम})
735	लक्ष्मणेन एतासु कस्याः राक्षस्याः नासिकाकर्णाः च न छिन्नाः?	त्रिजटायाः	 अयोमुख्याः / ताटकायाः / त्रिजटायाः / शूर्पणखायाः	त्रिजटायाः	1	(:Human {'lemma': लक्ष्मण})<-[:IS_DISFIGURED_BY]-({'lemma': अयोमुखी})	शूर्पणखायाः	1		"उत्तरम्: अयोमुख्याः

कारणम्: निष्कर्षित ज्ञानानुसारं, लक्ष्मणेन अयोमुख्याः नासिकाकर्णाः न छिन्नाः शूर्पणखायाः नासिकाकर्णाः रामेण छिन्नाः इति सूचितम् अतः विकल्पेषु अयोमुखी एव सा राक्षसी यस्याः नासिकाकर्णाः लक्ष्मणेन न छिन्नाः"	1	(:Human {'lemma': लक्ष्मण})<-[:IS_DISFIGURED_BY]-({'lemma': अयोमुखी}); (:Rakshashi {'lemma': शूर्पणखा})-[:WAS_DISFIGURED_BY]->({'lemma': राम})
736	एतासु का त्रयस्त्रिंशतः वैदिकदेवानां माता आसीत्?	अदितिः	 शतरूपा / अदितिः / अरुंधती / शची	अदितिः	1		अदितिः	1	(:Goddess {'lemma': अदिति})-[:IS_MOTHER_OF]->({'lemma': इन्द्र}); (:Goddess {'lemma': अदिति})-[:IS_WIFE_OF]->({'lemma': कश्यप}); (:Goddess {'lemma': अदिति})<-[:ARE_SONS_OF]-({'lemma': आदित्यगण})	अदितिः	1	(:Goddess {'lemma': अदिति})<-[:ARE_SONS_OF]-({'lemma': आदित्यगण}); (:Goddess {'lemma': अदिति})-[:IS_MOTHER_OF]->({'lemma': इन्द्र})
737	एतेषु कः योद्धा आसीत्, यः गोचर्मनिर्मितहस्तकोषान् धृत्वा युद्धमकरोत्?	मेघनादः	 मेघनादः / प्रहस्तः / सुग्रीवः / वाली	प्रहस्तः	1		मेघनादः	1		मेघनादः	1	(:Rakshasa {'lemma': मेघनाद})-[:WENT_TO_FIGHT_WITH]->({'lemma': हनुमान्}); (:Rakshasa {'lemma': मेघनाद})-[:IS_SON_OF]->({'lemma': रावण}); (:Rakshasa {'lemma': मेघनाद})<-[:IS_MOTHER_OF]-({'lemma': मन्दोदरी})
738	एतेषु कौ उभौ भ्रातरौ आस्ताम्, ययोः मुखाकृतिः समाना आसीत्?	वालिसुग्रीवौ	 रामलक्ष्मणौ / वालिसुग्रीवौ / खरदूषणौ / भरतशत्रुघ्नौ	वालिसुग्रीवौ	1	({'lemma': भरतशत्रुघ्न}); ({'lemma': रामलक्ष्मण}); ({'lemma': वालिन्सुग्रीव})	रामलक्ष्मणौ	1		"उत्तरम्: भरतशत्रुघ्नौ

रामायणे भरतः शत्रुघ्नश्च उभौ यमलौ भ्रातरौ आस्ताम्, ययोः मुखाकृतिः समाना आसीत् एतौ कैकेय्याः पुत्रौ, दशरथस्य च तनयौ तयोः समानाकृतित्वं रामायणे वर्णितम्"	1	
739	वैश्रवण: एतेषु कस्य नाम आसीत्?	कुबेरस्य	 कुबेरस्य / विश्वामित्रस्य / हनुमतः / जाम्बवतः	कुबेरस्य	1		कुबेरस्य	1		"उत्तरम्: कुबेरस्य

वैश्रवणः कुबेरस्य अपरं नाम आसीत् कुबेरः धनस्य देवता मन्यते, यस्य वैश्रवणः इति नामान्तरमपि प्रसिद्धम् अस्ति"	1	
740	एतेषु कस्य पृष्ठे उपविश्य श्रीरामः रावणेन सह युद्धमकरोत्?	हनुमतः	 सुग्रीवस्य / नलस्य / हनुमतः / नीलस्य	सुग्रीवस्य	1	(:Monkey {'lemma': सुग्रीव})-[:IS_ACCOMPANIED_BY]->({'lemma': नल})	सुग्रीवस्य	1	(:Rakshasa {'lemma': रावण})<-[:IS_CROSSED_BY]-({'lemma': पम्पा}); (:Monkey {'lemma': सुग्रीव})<-[:IS_FATHER_OF]-({'lemma': ऋक्षरजस्})	उत्तरम्: हनुमतः	1	
741	सिंधुजा एतासु कस्याः नाम अस्ति?	लक्ष्म्याः	 लक्ष्म्याः / सीतायाः / मंदोदर्याः / रूमायाः	सीतायाः	1		सीतायाः	1	(:Human {'lemma': सीता})-[:WAS_THREATENED_BY]->({'lemma': प्रघसा}); (:Human {'lemma': सीता})<-[:DID_INQUIRE_ABOUT]-({'lemma': राम})	सीतायाः	1	(:Human {'lemma': सीता})-[:WAS_THREATENED_BY]->({'lemma': प्रघसा}); (:Human {'lemma': सीता})-[:WAS_PLACED_AT]->({'lemma': पुष्पक})
742	एतेषु कस्य स्तोत्रस्य रचना रावणेन कृता आसीत् ?	शिवताण्डवस्तोत्रस्य	 महिम्नस्तोत्रस्य / रामरक्षास्तोत्रस्य / शिवताण्डवस्तोत्रस्य / विष्णुमहिम्नस्तोत्रस्य	शिवताण्डवस्तोत्रस्य	1	({'lemma': शिवताण्डवस्तोत्र}); ({'lemma': महिमन्स्तोत्र}); ({'lemma': रामरक्षास्तोत्र})	शिवताण्डवस्तोत्रस्य	1	(:Rakshasa {'lemma': रावण})<-[:IS_CROSSED_BY]-({'lemma': पम्पा})	"उत्तरम्: शिवताण्डवस्तोत्रस्य

रावणेन शिवताण्डवस्तोत्रस्य रचना कृता आसीत् एतत् स्तोत्रं शिवस्य स्तुतिपरकम् अस्ति, यत् रावणेन कैलासपर्वते रचितम् इति प्रसिद्धम्"	1	
743	एतेषु कस्य नाम 'एकाक्षपिंगली' अपि आसीत् ?	कुबेरस्य	 कुबेरस्य / विभीषणस्य / भरतस्य / शत्रुघ्नस्य	विभीषणस्य	1		विभीषणस्य	1		उत्तरम्: कुबेरस्य	1	
744	एतासु का देवासुरसंग्रामे राज्ञा दशरथेन सह गता आसीत् ?	कैकेयी	 कौसल्या / सुमित्रा / कैकेयी / मन्थरा	कैकेयी	1		कौसल्या	1		कैकेयी	1	(:Epithet {'lemma': दशरथ})-[:IS_FATHER_OF]->({'lemma': राम}); (:Epithet {'lemma': दशरथ})-[:IS_FATHER_OF]->({'lemma': लक्ष्मण}); (:Human {'lemma': कैकेयी})<-[:IS_REFERRED_BY]-({'lemma': अलर्क})
745	एतेषु कः 'वज्रङ्गबली' अपि उच्यते ?	हनुमान्	 सुग्रीवः / लक्ष्मणः / शिवः / हनुमान्	हनुमान्	1		हनुमान्	1		"उत्तरम्: हनुमान्

हनुमान् एव 'वज्रङ्गबली' इति नाम्ना अपि प्रसिद्धः वज्रसदृशदृढाङ्गत्वात् तस्य एतत् नाम प्रचलितम्"	1	
746	एतेषु कः 'महादेवः' अपि उच्यते ?	शिवः	 गणेशः / शिवः / ब्रह्मा / विष्णुः	शिवः	1		शिवः	1		"उत्तरम्: शिवः

शिवः एव 'महादेवः' इति नाम्ना प्रसिद्धः अयं हिन्दूधर्मे त्रिमूर्तीनां (ब्रह्मा, विष्णु, शिव) एकः, संहारकर्ता च 'महादेवः' इति विशेषणं शिवस्य महत्त्वं सूचयति"	1	
747	प्लक्षः एतेषु कस्य मन्त्री आसीत् ?	सुग्रीवस्य	 रावणस्य / दशरथस्य / जनकस्य / सुग्रीवस्य	सुग्रीवस्य	1	(:Monkey {'lemma': प्लक्ष})-[:IS_MINISTER_OF]->({'lemma': सुग्रीव}); (:Monkey {'lemma': सुग्रीव})<-[:IS_MINISTER_OF]-({'lemma': प्लक्ष})	सुग्रीवस्य	1	(:Monkey {'lemma': प्लक्ष})-[:IS_MINISTER_OF]->({'lemma': सुग्रीव}); (:Rakshasa {'lemma': रावण})<-[:IS_MINISTER_OF]-({'lemma': निकुम्भ})	सुग्रीवस्य	1	(:Monkey {'lemma': प्लक्ष})-[:IS_MINISTER_OF]->({'lemma': सुग्रीव})
748	एतेषु कः ऋषिः यः सदा वीणां धारयति ?	नारदः	 याज्ञवल्क्यः / नारदः / परशुरामः / धौम्यः	नारदः	1		नारदः	1		"उत्तरम्: नारदः

नारदः ऋषिः सदा वीणां धारयति इति प्रसिद्धम् स वीणावादनकुशलः देवर्षिः रामायणादिषु पुराणेषु च प्रसिद्धः"	1	
749	एतेषु कः 'नारायण-नारायण' इति कथयन् त्रिषु लोकेषु भ्रमति ?	नारदः	 विश्वामित्रः / गौतमः / नारदः / दुर्वासा	नारदः	1		नारदः	1		नारदः	1	(:Deva {'lemma': नारद})-[:IS_HONOURED_BY]->({'lemma': वाल्मीकि}); (:Deva {'lemma': नारद})<-[:IS_CURSED_BY]-({'lemma': नृग}); (:Deva {'lemma': नारद})<-[:HAS_INVOKED_THE_PROTECTION_OF]-({'lemma': कौसल्या})
750	महर्षिं वाल्मीकिं 'रामायणस्य' रचनायै एतेषु कः उक्तवान् आसीत् ?	नारदः	 ब्रह्मा / श्रीरामः / शिवः / नारदः	नारदः	1	(:Deva {'lemma': नारद})-[:IS_HONOURED_BY]->({'lemma': वाल्मीकि})	ब्रह्मा	1		नारदः	1	(:Deva {'lemma': नारद})-[:IS_HONOURED_BY]->({'lemma': वाल्मीकि}); (:Maharshi {'lemma': वाल्मीकि})<-[:IS_HONOURED_BY]-({'lemma': नारद})
751	रावणस्य आराध्यदेवः एतेषु कः आसीत्?	शिवः	 शिवः / विष्णुः / इन्द्रः / ब्रह्मा	शिवः	1		शिवः	1	(:Rakshasa {'lemma': रावण})<-[:IS_DEFEATED_BY]-({'lemma': कुम्भीनसी}); (:Rakshasa {'lemma': रावण})<-[:IS_DEFEATED_BY]-({'lemma': जटी}); (:Rakshasa {'lemma': रावण})<-[:IS_DEFEATED_BY]-({'lemma': तक्षक})	शिवः	1	(:Rakshasa {'lemma': रावण})-[:WAS_CURSED_BY]->({'lemma': नन्दिन्}); (:Rakshasa {'lemma': रावण})-[:LAUGHED_AT]->({'lemma': नन्दिन्})
752	विष्णोः अवतारः एतेषु कः अस्ति?	परशुरामः	 लक्ष्मणः / हनुमान् / परशुरामः / सुग्रीवः	परशुरामः	1		लक्ष्मणः	1	(:Human {'lemma': लक्ष्मण})<-[:IS_FATHER_OF]-({'lemma': दशरथ})	"उत्तरम्: परशुरामः

परशुरामः विष्णोः षष्ठः अवतारः मन्यते लक्ष्मणः, हनुमान् च रामस्य सहायकौ स्तः, न तु विष्णोः अवताराः सुग्रीवः वानरराजः आसीत्, सोऽपि न विष्णोः अवतारः"	1	
753	ेेएतासु कस्याः नाम 'गिरिजा' अस्ति?	पार्वत्याः	 सीता / पार्वती / मंदोदरी / सुलोचना	पार्वत्याः	1		पार्वती	1	(:Human {'lemma': सीता})-[:WAS_THREATENED_BY]->({'lemma': प्रघसा}); (:Human {'lemma': सीता})<-[:DID_INQUIRE_ABOUT]-({'lemma': राम})	"उत्तरम्: पार्वत्याः

पार्वती देवी शिवस्य पत्नी, हिमालयस्य पुत्री च सा गिरिजा इति नाम्ना अपि प्रसिद्धा, यतः 'गिरि' अर्थात् पर्वतस्य पुत्री अस्ति"	1	
754	एतेषु कः गायत्रीमन्त्रस्य रचनाम् अकरोत्?	विश्वामित्रः	 वाल्मीकिः / वसिष्ठः / भरद्वाजः / विश्वामित्रः	विश्वामित्रः	1		विश्वामित्रः	1		"उत्तरम्: विश्वामित्रः

गायत्रीमन्त्रस्य रचयिता विश्वामित्रः ऋषिः आसीत् स एव एतस्य महामन्त्रस्य द्रष्टा च आसीत्"	1	
