ID	QUESTION	ANSWER	CHOICES	gpt-4o	gpt-4o_maxd	gpt-4o_paths	mistral-large-latest	mistral-large-latest_maxd	mistral-large-latest_paths	claude-3-5-sonnet-20240620	claude-3-5-sonnet-20240620_maxd	claude-3-5-sonnet-20240620_paths
459	हनुमता सह सीतायाः सर्वप्रथमं  कस्मिन् स्थले मेलनम् अभवत्?	अशोकवाटिकायाम्; अशोकवनिकायाम्; अशोकवने; अशोकवने 		अशोकवाटिकायाम्	1		अशोकवनिकायाम्	1	(:Human {'lemma': सीता})-[:WAS_THREATENED_BY]->({'lemma': प्रघसा}); (:Human {'lemma': सीता})-[:WAS_PLACED_AT]->({'lemma': पुष्पक}); (:Human {'lemma': सीता})-[:IS_PLACED_BY]->({'lemma': त्रिजटा})	अशोकवाटिकायाम्	1	(:Human {'lemma': सीता})<-[:IS_CONFINEMENT_OF]-({'lemma': अशोकवाटिका})
460	प्रतिष्ठानपुरं कस्याः नद्याः तीरे अवस्थितम्?	गङ्गायमुुनयोः सङ्गमे		गोदावरी-नद्याः	1		सरयू	1		"उत्तरम्: गोदावर्याः

प्रतिष्ठानपुरं गोदावरी नद्याः तीरे अवस्थितम् आसीत् गोदावरी दक्षिण भारतस्य प्रमुखा नदी अस्ति, यस्याः तीरे प्रतिष्ठानपुरं नाम प्राचीनं नगरं स्थितम् आसीत्"	1	
461	श्रीरामस्य मित्रं प्रतर्दनः कस्य राजा आसीत्?	काश्याः		काशीराजः	1	(:God {'lemma': मित्र})-[:OBTAINED_THE_POSITION_OF]->({'lemma': वरुण})	काशीराजः	1		उत्तरम्: काशीराजस्य	1	
462	सुदामा नामकः पर्वतः कस्मिन् देशे स्थितः आसीत्?	बाह्रीकदेशे; बाह्लीके		भारतदेशे	1	(:Rishi {'lemma': पर्वत})-[:REPLIED_TO]->({'lemma': रावण}); (:Rishi {'lemma': पर्वत})<-[:IS_CURSED_BY]-({'lemma': नृग})	सुदामा नामकः पर्वतः दण्डकारण्ये स्थितः आसीत्	1		उत्तरम्: अयोध्यायाम्	1	
463	दक्षिणे स्थिते देशे चोले सीतायाः अन्वेषणं कर्तुं सुग्रीवः कम् प्रेषयामास?	अङ्गदम्		हनुमन्तम्	1	(:Monkey {'lemma': सुग्रीव})<-[:WAS_SENT_BY]-({'lemma': हनुमान्}); (:Monkey {'lemma': सुग्रीव})<-[:WAS_SENT_BY]-({'lemma': अङ्गद}); (:Monkey {'lemma': सुग्रीव})<-[:IS_SENT_BY]-({'lemma': अङ्गद}); (:Monkey {'lemma': सुग्रीव})<-[:WAS_SENT_BY]-({'lemma': सुषेण})	अङ्गदम्	1	(:Monkey {'lemma': सुग्रीव})<-[:IS_SENT_BY]-({'lemma': अङ्गद}); (:Monkey {'lemma': सुग्रीव})<-[:WAS_SENT_BY]-({'lemma': अङ्गद}); (:Monkey {'lemma': सुग्रीव})<-[:IS_SENT_BY]-({'lemma': अर्चिष्मान्}); (:Monkey {'lemma': सुग्रीव})<-[:IS_SENT_BY]-({'lemma': अर्चिमाल्यस्})	अङ्गदम्	1	(:Monkey {'lemma': सुग्रीव})<-[:IS_SENT_BY]-({'lemma': अङ्गद}); (:Country {'lemma': चोल})<-[:WAS_SENT_TO]-({'lemma': अङ्गद})
464	सीतायाः अन्वेषणाय सुग्रीवः मगधदेशं प्रति कम् प्रेषयामास?	विनतम्		अङ्गदम्	1		सीतायाः अन्वेषणाय सुग्रीवः मगधदेशं प्रति अङ्गदम् प्रेषयामास	1		अङ्गदम्	1	(:Monkey {'lemma': सुग्रीव})<-[:WAS_SENT_BY]-({'lemma': अङ्गद}); (:Monkey {'lemma': सुग्रीव})<-[:IS_SENT_BY]-({'lemma': अङ्गद}); (:Monkey {'lemma': सुग्रीव})<-[:WAS_SENT_BY]-({'lemma': हनुमान्}); (:Monkey {'lemma': सुग्रीव})<-[:WAS_SENT_BY]-({'lemma': सुषेण})
465	श्रीरामस्य मातुः किं नाम आसीत्?	कौसल्या		उत्तरम्: कौसल्या	1		कौसल्या	1		उत्तरम्: कौसल्यायाम्	1	
466	हनुमत: जननी का आसीत्?	अञ्जनी; अञ्जना		अञ्जना	1		अञ्जना	1		"उत्तरम्: अञ्जनायाम्

हनुमतः माता अञ्जना आसीत् रामायणे अञ्जना वानरराजस्य केसरिणः पत्नी एवं हनुमतः जननी रूपेण वर्णिता अस्ति"	1	
467	दशरथस्य माता का आसीत्?	इन्दुमतिः		इन्दुमती	1	(:Human {'lemma': दशरथ})-[:IS_KNOWN_AS]->({'lemma': दशरथ}); (:Epithet {'lemma': दशरथ})<-[:IS_KNOWN_AS]-({'lemma': दशरथ}); (:Epithet {'lemma': दशरथ})-[:IS_FATHER_OF]->({'lemma': राम}); (:Human {'lemma': दशरथ})<-[:IS_FATHER_OF]-({'lemma': अज})	दशरथस्य माता न ज्ञाता	1	(:Human {'lemma': दशरथ})<-[:IS_FATHER_OF]-({'lemma': अज}); (:Epithet {'lemma': दशरथ})-[:IS_FATHER_OF]->({'lemma': लक्ष्मण}); (:Epithet {'lemma': दशरथ})-[:IS_FATHER_OF]->({'lemma': राम})	लीलावत्या	1	(:Human {'lemma': दशरथ})-[:IS_KNOWN_AS]->({'lemma': दशरथ}); (:Epithet {'lemma': दशरथ})<-[:IS_KNOWN_AS]-({'lemma': दशरथ}); (:Human {'lemma': दशरथ})<-[:IS_FATHER_OF]-({'lemma': अज}); (:Epithet {'lemma': दशरथ})-[:IS_FATHER_OF]->({'lemma': लक्ष्मण})
468	रावणस्य माता का आसीत्?	कैकसी		कैकेसी	1		रावणस्य माता कैकसी आसीत्	1	(:Rakshasa {'lemma': रावण})<-[:IS_SON_OF]-({'lemma': मेघनाद}); (:Rakshasa {'lemma': रावण})<-[:IS_SON_OF]-({'lemma': देवान्तक}); (:Rakshasa {'lemma': रावण})<-[:IS_SON_OF]-({'lemma': इन्द्रजित्})	कैकसी	1	(:Rakshasa {'lemma': रावण})<-[:IS_SON_OF]-({'lemma': मेघनाद}); (:Rakshasa {'lemma': रावण})<-[:IS_SON_OF]-({'lemma': देवान्तक}); (:Rakshasa {'lemma': रावण})<-[:IS_SON_OF]-({'lemma': इन्द्रजित्})
469	जटायोः (गृद्धस्य) माता का आसीत्?	श्येनी		शेनी	1		जटायोः माता अरुणी आसीत्	1	(:Devine_bird {'lemma': जटायु})-[:LIVED_AT]->({'lemma': पञ्चवटी}); (:Devine_bird {'lemma': जटायु})-[:IS_BROTHER_OF]->({'lemma': सम्पाति}); (:Devine_bird {'lemma': जटायु})-[:IS_KILLED_BY]->({'lemma': रावण})	"उत्तरम्: श्येनीम्

यद्यपि रामायणे जटायोः मातुः नाम स्पष्टतया न उल्लिखितम्, परन्तु पौराणिक परम्परायाम् जटायोः माता श्येनी इति प्रसिद्धा श्येनी अरुणस्य पत्नी आसीत् या च जटायुं गरुडं च अजनयत्"	1	
470	मन्दोदर्याः मातुः किं नाम आसीत्?	हेमा		हेमामालिनी	1		कैकस्याः	1		उत्तरम्: हेमायाः	1	
471	विभीषणस्य माता का आसीत्?	कैकसी		कला	1	(:Rakshasa {'lemma': विभीषण})<-[:IS_DAUGHTER_OF]-({'lemma': कला}); (:Rakshasa {'lemma': विभीषण})<-[:IS_A_FOLLOWER_OF]-({'lemma': अनल}); (:Rakshasa {'lemma': विभीषण})<-[:IS_A_FOLLOWER_OF]-({'lemma': प्रमति})	कैकसी	1	(:Rakshasa {'lemma': विभीषण})<-[:IS_A_FOLLOWER_OF]-({'lemma': अनल}); (:Rakshasa {'lemma': विभीषण})<-[:IS_A_FOLLOWER_OF]-({'lemma': प्रमति}); (:Rakshasa {'lemma': विभीषण})<-[:IS_DAUGHTER_OF]-({'lemma': कला})	"उत्तरम्: केकसीम्

विभीषणस्य माता केकसी आसीत् रामायणे केकसी विश्रवसः पत्नी तथा रावण, कुम्भकर्ण, विभीषण च एतेषां त्रयाणां माता वर्णिता अस्ति"	1	
472	खरस्य मातुः नाम किम्?	पुष्पोत्कटा		ताडका	1	(:Rakshasa {'lemma': खर})-[:IS_BROTHER_OF]->({'lemma': शूर्पणखा}); (:Rakshasa {'lemma': खर})-[:IS_KILLED_BY]->({'lemma': राम}); (:Rakshasa {'lemma': खर})<-[:IS_A_GENERAL_OF]-({'lemma': करवीराक्ष})	शूर्पणखा	1	(:Rakshasa {'lemma': खर})-[:IS_BROTHER_OF]->({'lemma': शूर्पणखा}); (:Rakshasa {'lemma': खर})-[:IS_KILLED_BY]->({'lemma': राम}); (:Rakshasa {'lemma': खर})<-[:IS_A_GENERAL_OF]-({'lemma': करवीराक्ष})	खरस्य मातुः नाम ज्ञातं नास्ति रामायणे खरस्य मातुः नाम स्पष्टतया नोक्तम् ज्ञायते तु खरः शूर्पणखायाः भ्राता आसीदिति	1	(:Rakshasa {'lemma': खर})-[:IS_BROTHER_OF]->({'lemma': शूर्पणखा}); (:Rakshasa {'lemma': खर})-[:IS_KILLED_BY]->({'lemma': राम}); (:Rakshasa {'lemma': खर})<-[:IS_A_GENERAL_OF]-({'lemma': करवीराक्ष})
473	दूषणस्य मातुः नाम किम्?	वाका		कैकसी	1	(:Rakshasa {'lemma': दूषण})-[:IS_KILLED_BY]->({'lemma': राम}); (:Rakshasa {'lemma': दूषण})-[:IS_BROTHER_OF]->({'lemma': शूर्पणखा}); (:Rakshasa {'lemma': दूषण})<-[:IS_A_GENERAL_OF]-({'lemma': प्रमाथ})	ताटका	1	(:Rakshasa {'lemma': दूषण})-[:LIVED_AT]->({'lemma': जनस्थान}); (:Rakshasa {'lemma': दूषण})-[:IS_BROTHER_OF]->({'lemma': शूर्पणखा}); (:Rakshasa {'lemma': दूषण})-[:IS_KILLED_BY]->({'lemma': राम})	"उत्तरम्: अज्ञातम्

रामायणे दूषणस्य मातुः नाम स्पष्टतया न उल्लिखितम् दूषणः खरस्य अनुजः आसीत्, परन्तु तयोः मातुः विषये विशेषविवरणं न प्राप्यते अतः तस्याः नाम अज्ञातमेव मन्यते"	1	
474	मेघनादस्य मातुः नाम किम्?	मन्दोदरी		मन्दोदरी	1	(:Rakshasa {'lemma': मेघनाद})<-[:IS_MOTHER_OF]-({'lemma': मन्दोदरी}); (:Rakshasa {'lemma': मेघनाद})-[:IS_SON_OF]->({'lemma': रावण}); (:Rakshasa {'lemma': मेघनाद})-[:WENT_TO_FIGHT_WITH]->({'lemma': हनुमान्})	मन्दोदरी	1	(:Rakshasa {'lemma': मेघनाद})<-[:IS_MOTHER_OF]-({'lemma': मन्दोदरी}); (:Rakshasa {'lemma': मेघनाद})-[:IS_SON_OF]->({'lemma': रावण}); (:Rakshasa {'lemma': मेघनाद})-[:WENT_TO_FIGHT_WITH]->({'lemma': हनुमान्})	मन्दोदर्याः	1	(:Asura {'lemma': मन्दोदरी})-[:IS_MOTHER_OF]->({'lemma': मेघनाद}); (:Rakshasa {'lemma': मेघनाद})<-[:IS_MOTHER_OF]-({'lemma': मन्दोदरी})
475	मारीचस्य (राक्षसस्य) माता का आसीत्?	ताटका		ताडका	1		ताटका	1	(:Rakshasa {'lemma': मारीच})-[:IS_SON_OF]->({'lemma': ताटका})	ताटका	1	(:Rakshasa {'lemma': मारीच})-[:IS_SON_OF]->({'lemma': ताटका})
476	नलस्य (वानरस्य) माता का आसीत्?	घृताची		हंमती	1		अग्नि	1	(:Monkey {'lemma': नल})-[:IS_SON_OF]->({'lemma': अग्नि}); (:Monkey {'lemma': नल})<-[:FOUGHT_AGAINST]-({'lemma': प्रपतन}); (:Monkey {'lemma': नल})<-[:IS_FATHER_OF]-({'lemma': विश्वकर्मा})	नलस्य माता अज्ञाता दत्त-निष्कर्षणे नलस्य पितृ-सम्बन्धाः एव उल्लिखिताः, न तु मातृ-सम्बन्धः अतः मातुः नाम न ज्ञायते	1	(:Monkey {'lemma': नल})-[:IS_SON_OF]->({'lemma': अग्नि}); (:Monkey {'lemma': नल})<-[:IS_FATHER_OF]-({'lemma': विश्वकर्मा})
477	लक्ष्मणस्य माता का आसीत्?	सुमित्रा		सुमित्रा	1		सुमित्रा	1	(:Human {'lemma': लक्ष्मण})<-[:IS_FATHER_OF]-({'lemma': दशरथ}); (:Human {'lemma': लक्ष्मण})<-[:IS_SON_OF]-({'lemma': अङ्गद}); (:Human {'lemma': लक्ष्मण})<-[:IS_SON_OF]-({'lemma': चन्द्रकेतु})	सुमित्रा	1	(:Human {'lemma': लक्ष्मण})<-[:IS_SON_OF]-({'lemma': अङ्गद}); (:Human {'lemma': लक्ष्मण})<-[:IS_SON_OF]-({'lemma': चन्द्रकेतु})
478	महर्षेः परशुरामस्य माता का आसीत्?	रेणुका		रेणुका	1	(:Rishi {'lemma': परशुराम})<-[:IS_FATHER_OF]-({'lemma': जमदग्नि}); (:Rishi {'lemma': परशुराम})-[:CONTESTED_WITH]->({'lemma': राम}); (:Rishi {'lemma': परशुराम})-[:HAS_PROMISED_TO]->({'lemma': इन्द्र})	रेणुका	1		"उत्तरम्: रेणुकायाम्

महर्षेः परशुरामस्य माता रेणुका आसीत् रेणुका जमदग्नेः पत्नी च आसीत्"	1	
479	शत्रुघ्नस्य माता का आसीत्?	सुमित्रा		सुमित्रा	1		सुमित्रा	1	(:Human {'lemma': शत्रुघ्न})<-[:IS_FOUNDED_BY]-({'lemma': मधुरा})	"उत्तरम्: सुमित्रायाम्

शत्रुघ्नस्य माता सुमित्रा आसीत् सुमित्रा दशरथस्य तृतीया पत्नी आसीत्, या लक्ष्मणस्य शत्रुघ्नस्य च माता अभवत्"	1	
480	भरतस्य माता का आसीत्?	कैकेयी		कैकेयी	1		कैकेयी	1	(:Human {'lemma': भरत})<-[:IS_MATERNAL_UNCLE_OF]-({'lemma': अश्वपति}); (:Human {'lemma': भरत})<-[:IS_MATERNAL_UNCLE_OF]-({'lemma': युधाजित्})	कैकेय्या	1	(:Human {'lemma': कैकेयी})-[:IS_MOTHER_OF]->({'lemma': भरत}); (:Human {'lemma': भरत})<-[:IS_MOTHER_OF]-({'lemma': कैकेयी})
481	अङ्गदस्य मातुः नाम किमासीत्?	तारा		तारा	1	(:Monkey {'lemma': अङ्गद})-[:IS_SON_OF]->({'lemma': वालिन्}); (:Human {'lemma': अङ्गद})-[:IS_SON_OF]->({'lemma': लक्ष्मण}); (:Monkey {'lemma': अङ्गद})-[:IS_SENT_BY]->({'lemma': सुग्रीव})	तारा	1	(:Human {'lemma': अङ्गद})-[:IS_SON_OF]->({'lemma': लक्ष्मण}); (:Monkey {'lemma': अङ्गद})-[:IS_SON_OF]->({'lemma': वालिन्})	तारायाम्	1	(:Monkey {'lemma': अङ्गद})-[:IS_SON_OF]->({'lemma': वालिन्}); (:Human {'lemma': अङ्गद})-[:IS_SON_OF]->({'lemma': लक्ष्मण})
482	लवणासुरस्य माता का आसीत्?	कुम्भीनसी		मदिरा	1		मद्रु	1		"उत्तरम्: मदोद्कटायाम्

लवणासुरस्य माता मदोद्कटा नाम्नी राक्षसी आसीत् रामायणे वर्णितं यत् लवणासुरः मधुरासुरस्य पुत्रः आसीत्, तस्य माता च मदोद्कटा इति"	1	
483	शतानन्दस्य (जनकस्य पुरोहितस्य) मातुः नाम किमासीत्?	अहल्या		उत्तरम्: गौतमी	1		शतानन्दस्य मातुः नाम नास्ति	1		"उत्तरम्: अहल्यायाम्

शतानन्दः अहल्यायाः पुत्रः आसीत् अहल्या गौतमऋषेः पत्नी च आसीत् अतः शतानन्दस्य मातुः नाम अहल्या इति"	1	
484	अकम्पनराक्षसस्य माता का आसीत्?	केतुमती		सुरसा	1		अकम्पनराक्षसस्य माता ताटका आसीत्	1		"उत्तरम्: अज्ञातम्

रामायणे अकम्पनराक्षसस्य मातुः नाम स्पष्टतया न उल्लिखितम् तस्य वंशावलिः वा पूर्णरूपेण न वर्णिता अतः तस्य मातुः नाम अज्ञातमेव अस्ति"	1	
485	पूरोः माता का आसीत्?	शर्मिष्ठा		शर्मिष्ठा	1	(:Human {'lemma': पूरु})-[:IS_SON_OF]->({'lemma': ययाति}); (:Human {'lemma': पूरु})-[:IS_THE_KING_OF]->({'lemma': काशी})	पूरोः माता शर्मिष्ठा आसीत्	1	(:Human {'lemma': पूरु})-[:IS_THE_KING_OF]->({'lemma': काशी}); (:Human {'lemma': पूरु})-[:IS_SON_OF]->({'lemma': ययाति})	देवयानी	1	(:Human {'lemma': पूरु})-[:IS_SON_OF]->({'lemma': ययाति})
486	इन्द्रस्य मातुः नाम किमासीत्?	अदितिः		अदिति	1	(:God {'lemma': इन्द्र})-[:IS_SON_OF]->({'lemma': अदिति}); (:God {'lemma': इन्द्र})<-[:IS_MOTHER_OF]-({'lemma': अदिति}); (:God {'lemma': इन्द्र})-[:WAS_ACCOMPANIED_BY]->({'lemma': निद्रा})	अदिति	1	(:God {'lemma': इन्द्र})-[:IS_SON_OF]->({'lemma': अदिति}); (:God {'lemma': इन्द्र})<-[:IS_MOTHER_OF]-({'lemma': अदिति})	अदित्याम्	1	(:God {'lemma': इन्द्र})-[:IS_SON_OF]->({'lemma': अदिति}); (:God {'lemma': इन्द्र})<-[:IS_MOTHER_OF]-({'lemma': अदिति})
487	अतिकायस्य (रावणस्य पुत्रस्य) माता का आसीत्?	धान्यमालिनी		धान्यमालिनी	1	(:Rakshasa {'lemma': रावण})<-[:IS_SON_OF]-({'lemma': अतिकाय}); (:Rakshasa {'lemma': रावण})<-[:IS_SON_OF]-({'lemma': अतिकाय}); (:Rakshasa {'lemma': अतिकाय})<-[:IS_MOTHER_OF]-({'lemma': धान्यमालिनी}); (:Rakshasa {'lemma': अतिकाय})-[:IS_SON_OF]->({'lemma': रावण}); (:Rakshasa {'lemma': अतिकाय})-[:IS_SON_OF]->({'lemma': रावण})	धान्यमालिनी	1	(:Rakshasa {'lemma': अतिकाय})<-[:IS_MOTHER_OF]-({'lemma': धान्यमालिनी})	धन्यवाद: प्रश्नस्य क्षम्यताम्, परन्तु दत्तेषु निष्कर्षितेषु अतिकायस्य मातुः विषये कोऽपि उल्लेखो नास्ति रामायणानुसारं तु अतिकायस्य माता धान्यमालिनी आसीत् किन्तु इदं तथ्यं दत्तेषु निष्कर्षितेषु न दृश्यते अतः प्रश्नस्य सम्यक् उत्तरं दातुं न शक्नोमि	1	(:Rakshasa {'lemma': रावण})<-[:IS_SON_OF]-({'lemma': अतिकाय}); (:Rakshasa {'lemma': रावण})<-[:IS_SON_OF]-({'lemma': मेघनाद}); (:Rakshasa {'lemma': रावण})<-[:IS_SON_OF]-({'lemma': देवान्तक})
488	कुबेरस्य माता का आसीत्?	देववर्णिनी		देववर्णिनी	1	(:Rakshasa {'lemma': कुबेर})-[:IS_SON_OF]->({'lemma': विश्रवा}); (:Rakshasa {'lemma': कुबेर})-[:IS_SON_OF]->({'lemma': विश्रवा}); (:Rakshasa {'lemma': कुबेर})<-[:IS_MOTHER_OF]-({'lemma': देववर्णिनी}); (:Rakshasa {'lemma': कुबेर})<-[:IS_SON_OF]-({'lemma': नलकूवर}); (:Rakshasa {'lemma': कुबेर})<-[:IS_SON_OF]-({'lemma': नलकूवर})	इलविला	1	(:Rakshasa {'lemma': कुबेर})-[:IS_SON_OF]->({'lemma': विश्रवा}); (:Rakshasa {'lemma': कुबेर})<-[:IS_SON_OF]-({'lemma': नलकूवर}); (:Rakshasa {'lemma': कुबेर})<-[:IS_SON_OF]-({'lemma': गन्धमादन})	देववर्णिनी	1	(:Rakshasa {'lemma': कुबेर})<-[:IS_MOTHER_OF]-({'lemma': देववर्णिनी})
489	सुरसाया: मातुः नाम किमासीत्?	क्रोधवशा		सिंहिका	1		कद्रू	1		उत्तरम्: कद्रुः	1	
490	विराधराक्षसस्य मातुः नाम किमासीत्?	शतह्रदा		शतह्रदा	1		ताटका	1		"उत्तरम्: शतह्रदा

प्रश्ने विराधराक्षसस्य मातुः नाम पृष्टम् रामायणानुसारं विराधस्य माता शतह्रदा नाम्नी आसीत् अतः एकपदेन उत्तरं ""शतह्रदायाम्"" इति भवति"	1	
491	महोदरराक्षसस्य माता का आसीत् ?	पुष्पोत्कटा		कर्कटी	1		महोदरराक्षसस्य माता ताटका आसीत्	1		"उत्तरम्: सुकेशी

महोदरराक्षसस्य माता सुकेशी आसीत् सुकेशी राक्षसी आसीत् या विद्युज्जिह्वस्य पत्नी च आसीत्"	1	
492	नागानां माता का आसीत्?	सुरसा		कद्रू	1		कद्रू	1		कद्रुः	1	(:Human {'lemma': कद्रु})<-[:IS_MOTHER_OF]-({'lemma': क्रोधवशा}); (:Human {'lemma': कद्रु})-[:IS_DAUGHTER_OF]->({'lemma': कश्यप})
493	दुन्दुभिदैत्यस्य माता का आसीत्?	हेमा		दिति	1		दिति	1	(:Rakshasa {'lemma': दैत्य})<-[:IS_MOTHER_OF]-({'lemma': दिति})	"उत्तरम्: अज्ञातम्

रामायणे दुन्दुभिदैत्यस्य मातुः नाम स्पष्टतया न उल्लिखितम् तस्मात् तस्याः नाम अज्ञातम् इति वक्तुं शक्यते"	1	
494	महर्षेः दुर्वाससः मातुः नाम किम्?	अनसूया		अत्रि-पत्नी	1	({'lemma': महतृषिदुर्वासस्}); ({'lemma': मातृ})	अनसूया	1		उत्तरम्: अत्रेयी	1	
495	सिंहिका राक्षसी कस्य माता आसीत्?	राहोः		संपातेः	1		रावणस्य	1		"उत्तरम्: राहोः

सिंहिका राक्षसी राहोः माता आसीत् रामायणे सिंहिका एका राक्षसी वर्णिता, या समुद्रे निवसति स्म सा राहोः जननी इति प्रसिद्धा"	1	
496	हनुमतः पिता कः आसीत्?	केसरी		वायुः	1		केसरी	1		उत्तरम्: वायुना	1	
