ID	QUESTION	ANSWER	CHOICES	gpt-4o	gpt-4o_maxd	gpt-4o_paths	mistral-large-latest	mistral-large-latest_maxd	mistral-large-latest_paths	claude-3-5-sonnet-20240620	claude-3-5-sonnet-20240620_maxd	claude-3-5-sonnet-20240620_paths
225	जाम्बवान् सुग्रीवाय कति सैनिकान् दत्तवान्?	दशकोटिः		सहस्राणि	1		जाम्बवान् सुग्रीवाय कोटिशः सैनिकान् दत्तवान्	1	(:Monkey {'lemma': सुग्रीव})<-[:IS_VISITED_BY]-({'lemma': अस्ताचल}); (:Monkey {'lemma': सुग्रीव})<-[:IS_VISITED_BY]-({'lemma': द्विप}); (:Monkey {'lemma': सुग्रीव})<-[:IS_VISITED_BY]-({'lemma': उद्याचल})	प्रश्नस्य उत्तरं निश्चितरूपेण ज्ञातुं न शक्यते रामायणे जाम्बवान् द्वारा सुग्रीवाय दत्त सैनिकानां संख्या स्पष्टतया नोक्ता दत्त निष्कर्षितविषयेषु अपि एतत्सम्बद्धा जानकारी नास्ति अतः प्रश्नस्य सटीकम् उत्तरं दातुं न शक्यते	1	(:Monkey {'lemma': सुग्रीव})<-[:WAS_SENT_BY]-({'lemma': अङ्गद}); (:Monkey {'lemma': सुग्रीव})<-[:IS_SENT_BY]-({'lemma': अङ्गद}); (:Monkey {'lemma': सुग्रीव})<-[:WAS_SENT_BY]-({'lemma': हनुमान्}); (:Monkey {'lemma': सुग्रीव})<-[:WAS_SENT_BY]-({'lemma': सुषेण})
226	जाम्बवतः कियद्दूरपर्यन्तं उत्प्लवनसामर्थ्यम् आसीत्?	नवतिः योजनानि; नवतिः		नियतशतम् योजनानि	1		जाम्बवतः उत्प्लवनसामर्थ्यं नास्ति	1		उत्तरम्: योजनशतम्	1	
227	इन्द्रजानुः (वानरः) कियत्यः वानरान् निधाय श्रीरामस्य सहाय्यार्थम् आगतः?	एकादशकोटिः; एकादशानां कोटीनाम्; एकादशकोटीभिः; एकादशकोटयः		सहस्राणि	1	(:Monkey {'lemma': इन्द्रजानु})-[:IS_HONOURED_BY]->({'lemma': राम}); (:Animal {'lemma': वानर})-[:JOINED_THE_FORCE_OF]->({'lemma': राम})	इन्द्रजानुः वानरान् निधाय श्रीरामस्य सहाय्यार्थम् आगतः	1	(:Monkey {'lemma': इन्द्रजानु})-[:IS_HONOURED_BY]->({'lemma': राम}); (:Animal {'lemma': वानर})-[:JOINED_THE_FORCE_OF]->({'lemma': राम}); (:Animal {'lemma': वानर})-[:LIVED_AT]->({'lemma': चन्दनवन})	कोटिम्	1	(:Animal {'lemma': वानर})-[:JOINED_THE_FORCE_OF]->({'lemma': राम}); (:Rakshasa {'lemma': इन्द्रजित्})<-[:WENT_IN_THE_SEARCH_OF]-({'lemma': ऋषभस्कन्ध})
228	समुद्रमन्थनात् आहत्य कति रत्नानि प्राप्तानि?	चतुर्दश		चतुर्दश	1		चतुर्दश	1		उत्तरम्: चतुर्दश	1	
229	रावणस्य कतिः भुजाः आसन्?	विंशतिः		दश	1		रावणस्य दश भुजाः आसन्	1	(:Rakshasa {'lemma': रावण})<-[:IS_CROSSED_BY]-({'lemma': पम्पा})	"उत्तरम्: दश

रावणस्य दश भुजाः आसन् अतः एव सः दशाननः इति नाम्ना अपि प्रसिद्धः आसीत्"	1	
230	समुद्रमन्थनसमये आहत्य कति अप्सरसः उत्पन्नाः?	षट्कोटिः		सप्त	1		समुद्रमन्थनसमये आहत्य छः अप्सरसः उत्पन्नाः	1		"उत्तरम्: षोडश

यद्यपि प्रश्ने ""आहत्य"" शब्दः प्रयुक्तः, समुद्रमन्थनसमये उत्पन्नानाम् अप्सरसां संख्या सामान्यतया षोडश इति प्रसिद्धम् रामायणे च अन्येषु पुराणेषु च एषा संख्या उल्लिखिता दृश्यते"	1	
231	परशुरामः आहत्य कतिवारं क्षत्रियाणां संहारं कृतवान् ?	एकविंशतिवारम्; एकविंशतिः		सप्तकृत्वः	1	(:Rishi {'lemma': परशुराम})-[:CONTESTED_WITH]->({'lemma': राम}); (:Rishi {'lemma': परशुराम})<-[:IS_FATHER_OF]-({'lemma': जमदग्नि}); (:Rishi {'lemma': परशुराम})-[:HAS_PROMISED_TO]->({'lemma': इन्द्र})	परशुरामः एकविंशतिवारं क्षत्रियाणां संहारं कृतवान्	1	(:Rishi {'lemma': परशुराम})<-[:IS_FATHER_OF]-({'lemma': जमदग्नि})	"उत्तरम्: एकविंशतिवारान्

परशुरामः क्षत्रियाणां संहारं एकविंशतिवारान् (21 वारान्) कृतवान् इति रामायणे प्रसिद्धम् अयं संहारः परशुरामस्य पितृवधस्य प्रतिशोधार्थं कृतः"	1	
232	शिवस्य जटातः मुक्त्वा गङ्गायाः कियत्यः धाराः अभवन् ?	सप्त		सप्तधाराः	1		एका	1	(:River {'lemma': गङ्गा})-[:WAS_RELEASED_BY]->({'lemma': शङ्कर}); (:River {'lemma': गङ्गा})-[:WAS_RELEASED_INTO]->({'lemma': बिन्दु}); (:River {'lemma': गङ्गा})-[:IS_DAUGHTER_OF]->({'lemma': हिमवान्})	सप्त धाराभिः	1	(:River {'lemma': गङ्गा})-[:WAS_RELEASED_INTO]->({'lemma': बिन्दु}); (:River {'lemma': गङ्गा})-[:WAS_RELEASED_BY]->({'lemma': शङ्कर}); (:River {'lemma': गङ्गा})-[:IS_DAUGHTER_OF]->({'lemma': हिमवान्})
233	वसूनां आहत्य कियती संख्या गण्यते ?	अष्टौ; अष्ट		अष्टौ	1	(:Human {'lemma': वसु})-[:IS_SON_OF]->({'lemma': कुश})	8	1	(:Human {'lemma': वसु})-[:IS_SON_OF]->({'lemma': कुश})	अष्टौ	1	(:Human {'lemma': वसु})-[:IS_SON_OF]->({'lemma': कुश})
234	कुबेरसमतयाः कामनया रावणः किति सहस्रवर्षाणां  तपः अचरत् ?	दशसहस्रस्य; दश; दशसहस्रवर्षाणि		सहस्रवर्षाणाम्	1	(:Rakshasa {'lemma': कुबेर})-[:IS_BROTHER_OF]->({'lemma': रावण}); (:Rakshasa {'lemma': रावण})<-[:IS_BROTHER_OF]-({'lemma': कुबेर}); (:Rakshasa {'lemma': रावण})-[:PRACTICED_AUSTERITIES_AT]->({'lemma': गोकर्ण})	दशसहस्रवर्षाणाम्	1	(:Rakshasa {'lemma': रावण})<-[:IS_CROSSED_BY]-({'lemma': पम्पा}); (:Rakshasa {'lemma': रावण})-[:WAS_ACCOMPANIED_BY]->({'lemma': त्रिशिस्}); (:Rakshasa {'lemma': रावण})<-[:IS_A_GENERAL_OF]-({'lemma': यूपाक्ष})	दश सहस्रवर्षाणि	1	(:Rakshasa {'lemma': कुबेर})-[:IS_BROTHER_OF]->({'lemma': रावण}); (:Rakshasa {'lemma': रावण})<-[:IS_BROTHER_OF]-({'lemma': कुबेर}); (:Rakshasa {'lemma': रावण})-[:PRACTICED_AUSTERITIES_AT]->({'lemma': गोकर्ण})
235	श्रीरामस्य सहायतायै हनुमता सह कियन्तः वानराः आगच्छन् ?	दशवृन्दम्		वानराः	1	(:Animal {'lemma': वानर})-[:JOINED_THE_FORCE_OF]->({'lemma': राम})	अनेकाः	1	(:Animal {'lemma': वानर})-[:JOINED_THE_FORCE_OF]->({'lemma': राम}); (:Animal {'lemma': वानर})-[:LIVED_AT]->({'lemma': चन्दनवन})	वानरैः	1	(:Animal {'lemma': वानर})-[:JOINED_THE_FORCE_OF]->({'lemma': राम})
236	राज्ञः सगरस्य कति राज्ञः आसन् ?	द्वे		षष्टिः	1	(:King {'lemma': सगर})-[:IS_FATHER_OF]->({'lemma': पुत्राः}); (:Human {'lemma': सगर})-[:IS_FATHER_OF]->({'lemma': असमञ्ज}); (:Human {'lemma': सगर})<-[:IS_FATHER_OF]-({'lemma': असित})	राज्ञः सगरस्य द्वौ पुत्रौ आसन्	1	(:Human {'lemma': सगर})-[:IS_FATHER_OF]->({'lemma': असमञ्ज}); (:Human {'lemma': सगर})<-[:IS_FATHER_OF]-({'lemma': असित}); (:Human {'lemma': सगर})-[:IS_POISONED_BY]->({'lemma': असितभार्या})	षष्टिसहस्रैः पुत्रैः	1	(:King {'lemma': सगर})-[:IS_FATHER_OF]->({'lemma': पुत्राः}); (:Human {'lemma': सगर})-[:IS_FATHER_OF]->({'lemma': असमञ्ज}); (:Human {'lemma': सगर})<-[:IS_FATHER_OF]-({'lemma': असित})
237	राज्ञः सगरस्य कियतः पुत्रान् कपिलमुनिः भस्मीकृतवान् आसीत्?	षष्टिसहस्रम्		षष्टिः	1		षष्टिः	1	(:Human {'lemma': सगर})-[:IS_FATHER_OF]->({'lemma': असमञ्ज}); (:Human {'lemma': सगर})<-[:IS_FATHER_OF]-({'lemma': असित}); (:Human {'lemma': सगर})-[:IS_POISONED_BY]->({'lemma': असितभार्या})	षष्टिसहस्रान्	1	(:King {'lemma': सगर})-[:IS_FATHER_OF]->({'lemma': पुत्राः}); (:King {'lemma': सगर})<-[:IS_WIFE_OF]-({'lemma': सुमति}); (:Human {'lemma': सगर})-[:IS_FATHER_OF]->({'lemma': असमञ्ज})
238	प्रजापतीनां संख्या आहत्य कियती अस्ति?	दश		त्रयोदश	1		प्रजापतीनां संख्या आहत्य नास्ति	1	(:Epithet {'lemma': प्रजापति})<-[:IS_KNOWN_AS]-({'lemma': दक्ष})	प्रजापतीनां संख्या आहत्य सप्त अस्ति	1	(:Epithet {'lemma': प्रजापति})<-[:IS_KNOWN_AS]-({'lemma': दक्ष})
239	वानरयूथपतिः गवाक्षः कियतीं सेनां नीत्वा सुग्रीवस्य समीपं आयातः ?	एकवृन्दम्		वानरयूथपतिः गवाक्षः शतसहस्रं वानराणां सेनां नीत्वा सुग्रीवस्य समीपं आयातः	1	(:Monkey {'lemma': सुग्रीव})<-[:CAME_TO_VISIT]-({'lemma': गवय}); (:Monkey {'lemma': सुग्रीव})-[:IS_ACCOMPANIED_BY]->({'lemma': नल})	गवाक्षः दशलक्षानि वानरान् नीत्वा सुग्रीवस्य समीपं आयातः	1	(:Monkey {'lemma': गवाक्ष})-[:IS_APPOINTED_AS]->({'lemma': यूथपति}); (:Monkey {'lemma': गवाक्ष})<-[:BELONGED_TO]-({'lemma': भवन})	"उत्तरम्: कोटिम्

यद्यपि प्रश्ने ""nan"" दृश्यते, रामायणानुसारं गवाक्षः कोटिसंख्यकवानरसेनां नीत्वा सुग्रीवस्य समीपम् आगतः इति ज्ञायते अतः एकपदेन उत्तरं ""कोटिम्"" इति भवति"	1	
240	अश्विनीकुमाराणां संख्या कियती अस्ति ?	द्वौ		द्वौ	1		द्वौ	1		"उत्तरम्: द्वौ

अश्विनीकुमारौ देवताद्वयम् आस्ताम् तयोः संख्या द्वे एव अस्ति"	1	
241	माता कौसल्या कियतां मासानां गर्भधारणं कृत्वा श्रीरामं प्रसूतवती ?	द्वादश		नवमासान्	1	(:Human {'lemma': कौसल्या})-[:IS_MOTHER_OF]->({'lemma': राम})	दशमासानां	1		द्वादशभिः मासैः	1	(:Human {'lemma': कौसल्या})-[:IS_MOTHER_OF]->({'lemma': राम}); (:Human {'lemma': कौसल्या})-[:HAS_INVOKED_THE_PROTECTION_OF]->({'lemma': नारद}); (:Human {'lemma': कौसल्या})-[:HAS_INVOKED_THE_PROTECTION_OF]->({'lemma': पिशाच})
242	त्रिशिराराक्षसस्य आगत्य कियन्ति शिरांसि आसन् ?	त्रीणि		त्रीणि	1		त्रिशिराराक्षसस्य आगत्य त्रीणि शिरांसि आसन्	1		"उत्तरम्: त्रीणि

त्रिशिराराक्षसस्य नामानुसारमेव स्पष्टं यत् तस्य त्रीणि शिरांसि आसन् ""त्रिशिरा"" इति नाम्नः अर्थः एव ""त्रीणि शिरांसि यस्य सः"" इति"	1	
243	धूम्रः (ऋक्षः) कियतीं सेनां नीत्वा श्रीरामस्य सहायार्थं प्राप्तः ?	विंशतिवृन्दम्		ऋक्षसहस्रम्	1	(:Riksha {'lemma': धूम्र})-[:IS_HONOURED_BY]->({'lemma': राम}); (:Cave {'lemma': ऋक्ष})-[:IS_SEEN_BY]->({'lemma': अङ्गद})	धूम्रः ऋक्षः सहस्राणि दश सेनां नीत्वा श्रीरामस्य सहायार्थं प्राप्तः	1	(:Riksha {'lemma': धूम्र})-[:IS_HONOURED_BY]->({'lemma': राम}); (:Riksha {'lemma': धूम्र})-[:DWELT_AT]->({'lemma': ऋक्षवान्}); (:Cave {'lemma': ऋक्ष})-[:IS_SEEN_BY]->({'lemma': अङ्गद})	कोटिसङ्ख्यकाम्	1	(:Riksha {'lemma': धूम्र})-[:IS_HONOURED_BY]->({'lemma': राम}); (:Riksha {'lemma': धूम्र})-[:DWELT_AT]->({'lemma': ऋक्षवान्}); (:Cave {'lemma': ऋक्ष})-[:IS_SEEN_BY]->({'lemma': अङ्गद})
244	लोकपालाः कियन्तः सन्ति ?	अष्टौ		अष्टौ	1		लोकपालाः चत्वारः सन्ति	1		"उत्तरम्: अष्टौ

लोकपालाः अष्टौ सन्ति ते अष्टदिक्पालाः इत्यपि कथ्यन्ते, ये अष्टदिशां रक्षकाः भवन्ति"	1	
245	नलः कियतीं सेनां नीत्वा श्रीरामस्य सहायार्थमागच्छत्?	शतोत्तरैकसहस्राधिकैकवृन्दम्		"प्रश्नः: नलः कियतीं सेनां नीत्वा श्रीरामस्य सहायार्थमागच्छत्?

उत्तरम्: वानरसेनाम्"	1	(:Monkey {'lemma': नल})<-[:IS_FATHER_OF]-({'lemma': विश्वकर्मा}); (:Monkey {'lemma': नल})-[:IS_SON_OF]->({'lemma': अग्नि}); (:Monkey {'lemma': नल})<-[:IS_ACCOMPANIED_BY]-({'lemma': सुग्रीव})	नलः महतीं सेनां नीत्वा श्रीरामस्य सहायार्थमागच्छत्	1	(:Monkey {'lemma': नल})-[:IS_SON_OF]->({'lemma': अग्नि}); (:Monkey {'lemma': नल})<-[:FOUGHT_AGAINST]-({'lemma': प्रपतन}); (:Monkey {'lemma': नल})<-[:IS_FATHER_OF]-({'lemma': विश्वकर्मा})	क्षमस्व, प्रश्ने नलस्य सेनाया: संख्या विषये स्पष्टं तथ्यं नास्ति रामायणे नलस्य सेनाया: विशिष्टा संख्या न उल्लिखिता नल: सुग्रीवेण सह रामस्य सहायार्थम् आगतवान् इति ज्ञायते, परं तस्य सैन्यसंख्या अनिर्दिष्टा वर्तते	1	(:Monkey {'lemma': नल})<-[:IS_ACCOMPANIED_BY]-({'lemma': सुग्रीव}); (:Monkey {'lemma': नल})-[:IS_SON_OF]->({'lemma': अग्नि}); (:Monkey {'lemma': नल})<-[:IS_FATHER_OF]-({'lemma': विश्वकर्मा})
246	अश्वमेधयज्ञः कियता कालेन समाप्तो भवति?	एकवर्षे; वर्षेण; त्र्यहः		वर्षेण	1		अश्वमेधयज्ञः एकेन वर्षेण समाप्तो भवति	1		"उत्तरम्: एकेन वर्षेण

रामायणे वर्णितानुसारं, अश्वमेधयज्ञः सामान्यतया एकं वर्षं यावत् चलति यज्ञाश्वः एकं वर्षं यावत् स्वेच्छया विचरति, तदनन्तरं यज्ञकर्म सम्पाद्यते अतः अश्वमेधयज्ञः एकेन वर्षेण समाप्यते"	1	
247	सप्तर्षीणाम् संख्या कियती ?	सप्त		सप्त	1		सप्तर्षीणाम् संख्या सप्त	1		"उत्तरम्: सप्तभिः

सप्तर्षीणाम् नाम्नि एव ""सप्त"" शब्दः विद्यते, यः तेषां संख्यां सूचयति अतः सप्तर्षीणां संख्या सप्त एव भवति"	1	
248	वानरयूथपतिः तारः कियतः वानरान् नीत्वा रामस्य सहायार्थं प्राप्तः?	पञ्चकोटिः; पञ्चकोटिभिः		वानरयूथपतिः तारः सहस्राणि	1	(:Human {'lemma': राम})<-[:JOINED_THE_FORCE_OF]-({'lemma': वानर}); (:Animal {'lemma': वानर})-[:JOINED_THE_FORCE_OF]->({'lemma': राम}); (:Human {'lemma': राम})-[:FORMED_AN_ACQUAINTANCE_WITH]->({'lemma': हनुमान्})	तारः वानरान् नीत्वा रामस्य सहायार्थं प्राप्तः नास्ति	1	(:Monkey {'lemma': तार})<-[:IS_FATHER_OF]-({'lemma': बृहस्पति}); (:Human {'lemma': राम})<-[:IS_FATHER_OF]-({'lemma': दशरथ}); (:Human {'lemma': राम})<-[:IS_CROSSED_BY]-({'lemma': गोमती})	क्षमस्व, रामायणे तारस्य नेतृत्वे आगतानां वानराणां सङ्ख्या स्पष्टतया नोक्ता तारः सुग्रीवस्य सेनापतिः आसीत्, परन्तु तस्य नेतृत्वे आगतानां वानराणां विशिष्टा सङ्ख्या न ज्ञायते रामस्य सहायार्थं सुग्रीवेण प्रेषिताः बहवः वानराः आगताः इति तु निश्चितम्	1	
249	तानि कियन्तः अस्त्राः आसन्, यानि प्रजापतेः कृशाश्वस्य पुत्राः आसन् तथा यान् महर्षिः विश्वामित्रः श्रीरामाय अददात्?	शतम्		द्वादश	1		तानि सप्त अस्त्राः आसन्	1	(:Rishi {'lemma': विश्वामित्र})<-[:IS_FATHER_OF]-({'lemma': गाधि})	"शतम्

कृशाश्वस्य पुत्राः शतम् अस्त्राणि आसन्, यानि विश्वामित्रः श्रीरामाय अददात्"	1	(:Prajapati {'lemma': कृशाश्व})<-[:ARE_PRODUCED_BY]-({'lemma': शस्त्र}); (:Rishi {'lemma': विश्वामित्र})<-[:IS_SON_OF]-({'lemma': मधुस्पन्द}); (:Rishi {'lemma': विश्वामित्र})<-[:IS_SON_OF]-({'lemma': दृढनेत्र})
250	ऋषेः वसिष्ठस्य कियन्तः पुत्राः आसन् ?	शतम्; शतपुत्राः		सप्त	1		ऋषेः वसिष्ठस्य सप्त पुत्राः आसन्	1		"उत्तरम्: शतम्

वसिष्ठस्य शतं पुत्राः आसन् इति रामायणे वर्णितम् एतत् संख्या प्रसिद्धा अस्ति, यद्यपि तेषां सर्वेषां नामानि न ज्ञायन्ते"	1	
251	गन्धमादनः (वानरः) एकस्मिन् उत्प्लवने कियत् दूरं गन्तुं समर्थः आसीत्?	पञ्चाशत् योजनानि		योजनशतम्	1		गन्धमादनः एकस्मिन् उत्प्लवने सहस्रयोजनं गन्तुं समर्थः आसीत्	1	(:Monkey {'lemma': गन्धमादन})-[:IS_SON_OF]->({'lemma': कुबेर}); (:Animal {'lemma': वानर})-[:LIVED_AT]->({'lemma': चन्दनवन}); (:Animal {'lemma': वानर})-[:JOINED_THE_FORCE_OF]->({'lemma': राम})	क्षमस्व, प्रश्ने दत्तायां जानकार्यां गन्धमादनस्य उत्प्लवन-क्षमतायाः विषये स्पष्टं विवरणं नास्ति निष्कर्षितेषु तथ्येषु अपि तस्य उत्प्लवन-शक्तेः विषये कोऽपि उल्लेखो न दृश्यते अतः अस्य प्रश्नस्य सटीकम् उत्तरं दातुं न शक्नोमि	1	(:Animal {'lemma': वानर})-[:JOINED_THE_FORCE_OF]->({'lemma': राम}); (:Monkey {'lemma': गन्धमादन})-[:IS_SON_OF]->({'lemma': कुबेर}); (:Animal {'lemma': वानर})-[:LIVED_AT]->({'lemma': चन्दनवन})
252	सुषेणः (वानरः) एकस्मिन् उत्प्लवने कियद्दूरं गन्तुं समर्थः आसीत्?	अशीति योजनानि; अशीतियोजनानि		दशयोजनम्	1		"सुषेणः एकस्मिन् उत्प्लवने कियद्दूरं गन्तुं समर्थः आसीत्?

उत्तरम्: न ज्ञायते"	1	(:Monkey {'lemma': सुषेण})-[:IS_ASKED_TO_GO_TO]->({'lemma': मुरवीपत्तन}); (:Monkey {'lemma': सुषेण})-[:WAS_ASKED_TO_VISIT]->({'lemma': बाह्लीक}); (:Monkey {'lemma': सुषेण})-[:WAS_SENT_TO]->({'lemma': अङ्गलेपा})	उत्तरम्: शतयोजनानि	1	(:Monkey {'lemma': सुषेण})-[:IS_ASKED_TO_GO_TO]->({'lemma': मुरवीपत्तन}); (:Monkey {'lemma': सुषेण})-[:WAS_ASKED_TO_VISIT]->({'lemma': बाह्लीक}); (:Monkey {'lemma': सुषेण})-[:WAS_SENT_TO]->({'lemma': अङ्गलेपा})
