ID	QUESTION	ANSWER	CHOICES
362	यस्य मुखभागः हस्तयोः अञ्जलिना सदृशः भवति तं बाणं किम् उक्तवन्तः?	अञ्जलिकः	
363	यस्य बाणस्य अग्रभागः गोवत्सस्य दन्तैः सदृशः दृश्यते तं किम् उक्तवन्तः?	वत्सदन्तः	
364	सिंहस्य दन्तैः तुल्यः अग्रभागः यस्य बाणस्य तस्य नाम किम्?	सिंहदंष्ट्रः	
365	यस्य बाणस्य अग्रभागः क्षुरस्य धारयाः सदृशः भवति तं किम् उक्तवन्तः?	क्षुरः; क्षुरम्	
366	एतेषु कः अस्त्रः अस्ति?	अञ्जलिकः; अंजलिकः	 असिः / अंजलिकः / गदा / खड्गः
367	एतेषु कः शस्त्रः अस्ति?	खड्गः	 नाराचः / भल्लः / अंजलिकः / खड्गः
368	विष्णोः धनुषः नाम किम्?	शार्ङ्गम्; शार्ङ्गः	
369	कस्य अस्त्रस्य प्रयोगेण श्रीरामः कुम्भकर्णं मारितवान्?	ऐन्द्रास्त्रस्य; ऐन्द्रास्त्रेण	
370	विभीषणाय ब्रह्मास्त्रं कः दत्तवान्?	ब्रह्मा	
371	श्रीरामाय 'जृंभकास्त्रं' कः दत्तवान् ?	विश्वामित्रः	
372	श्रीरामाय 'वायव्यास्त्रं' कः दत्तवान् ?	विश्वामित्रः	
373	श्रीरामाय 'वरुणपाशं' कः दत्तवान् ?	विश्वामित्रः	
374	सार्चिमाली'नामकं अस्त्रं श्रीरामाय कः दत्तवान् ?	विश्वामित्रः	
375	सर्पनाथः'नामकं अस्त्रं श्रीरामाय कः दत्तवान् ?	विश्वामित्रः	
376	मेघनादाय 'ब्रह्मशिरः'नामकं अस्त्रं कः दत्तवान् ?	ब्रह्मा	
377	श्रीरामाय 'सत्यवान्'नामकं अस्त्रं कः दत्तवान् ?	विश्वामित्रः	
378	सत्यकीर्तिः'नामकं अस्त्रं श्रीरामाय कः दत्तवान् ?	विश्वामित्रः	
379	रुचिरः'नामकं अस्त्रं श्रीरामाय कः समर्पितवान्?	विश्वामित्रः	
380	लक्ष्मणः केन अस्त्रेण युद्धं कुरति स्म ?	धनुषा	
381	वज्र इति अस्त्रः कस्य देवस्य आसीत्?	इन्द्रस्य	
382	हनुमान् केन शस्त्रेण युद्धं अकरोत्?	गदया	
383	नागपाशः' इति अस्त्रं मेघनादः कस्मात् प्राप्तवान्?	इन्द्रात्	
384	नागपाशः कस्य देवस्य अस्त्रम् अस्ति?	वरुणस्य; वरुणदेवस्य	
385	महर्षिणा अगस्त्येन श्रीरामाय यत् दिव्यं धनुः दत्तम् आसीत् तत् कस्य आसीत्?	विष्णोः; श्रीविष्णोः	
386	सः कः अस्त्रः यस्य प्रयोगे सति प्रस्तराणां वर्षणं भवति?	पर्वतास्त्रः; पर्वतास्त्रम्; पार्वतास्त्रः	
387	राजा दशरथः भ्रमात् श्रवणकुमारं येन बाणेन प्रहृतवान् सः किमुच्यते?	शब्दभेदी; शब्दवेधी	
388	राजा जनकः श्रीरामाय यत् दिव्यं धनुः अभेद्यं कवचम् अक्षयबाणैः युक्तः तूणीरः सुवर्णभूषितं खङ्गं च दत्तवान्  एतानि जनकाय कः प्रदत्तवान्?	वरुणः	
389	तामसः' इति भयानकम् अस्त्रं कस्य देवस्य अस्ति?	राहोः (तमोग्रहस्य)	
390	तस्य अस्त्रस्य नाम वद यस्य प्रहारं कृत्वा लवेन (वाल्मीकेः आश्रमस्य समीपे) अयोध्यायाः प्राप्ता श्रीरामस्य सेनाः निद्रापिताः?	जृम्भकास्त्रम्	
391	लोहकण्टकयुता चतुर्हस्तोन्नता गदा किमुच्यते ?	शतघ्नी	
392	राजा जनकः श्रीरामाय (कन्यामूल्यरूपेण) कति दिव्यानि धनूंषि दत्तवान् ?	द्वे	
393	लवणासुरस्य समीपे यः महाशूलः अस्ति सः कस्मात् लब्धः?	मधुुदैत्यात्; मधोः	
394	महर्षेः वाल्मीकेः आश्रमः कस्याः नद्याः तीरे आसीत् ?	तमसायाः; तमसा नद्याः	
395	श्रीरामे वनं गते भरतः तेषां वियोगे अयोध्यायाः बहिः कस्मिन् स्थले वसति स्म?	नन्दीग्रामे	
396	यदा रामः वनवासाय गच्छन् आसीत् तदा भरतः शत्रुघ्नः च कुत्र स्थितौ आस्ताम्?	मातुलगृहे केकयदेशे; मातुलगृहे; कैकयदेशे	
397	वनवासकाले श्रीरामः सर्वाधिकं कालं कस्मिन् स्थले यापितवान्?	चित्रकूटे	
398	शबरी कस्मिन् वने निवसति स्म?	मतङ्गवने	
399	किष्किन्धायां वालिना निष्कासितः सुग्रीवः कुत्र वसति स्म?	ऋष्यमूकपर्वते; ऋष्यमूके	
400	लंकां प्राप्त्य श्रीरामस्य वानरसेना कस्य पर्वतस्य समीपे स्थितवती?	सुवेलस्य	
401	हनुमान् कं पर्वतम् आरुह्य समुद्रं लङ्घयितुं प्लुतवान्?	महेन्द्रम्; महेन्द्र पर्वतम्; महेन्द्रपर्वतम्	
402	लंका नगरी कस्य पर्वतस्य उपरि स्थिता आसीत्?	त्रिकूटपर्वतस्य; त्रिकूटस्य; त्रिकूट पर्वतस्य	
403	विशल्यकरणी, सावर्ण्यकरणी, सञ्जीवकरणी, सन्धानी नामकाः ओषधय: कस्मिन् पर्वते लभ्यन्ते स्म?	महोदये; औषधिपर्वते	
404	महर्षे: परशुरामस्य आश्रम: कस्मिन् पर्वते स्थित: आसीत्?	महेन्द्रपर्वते; महेन्द्रे	
405	श्रीराम:, सीता, लक्ष्मण: च श्रृंगवेरपुरस्य समीपे कां नदीं तीर्त्वा गमनं कृतवन्त:?	गङ्गाम्; गङ्गानदीम्	
406	कुश-लवयो: जन्म कुत्र अभवत्?	वाल्मीकेः आश्रमे; वाल्मीकिआश्रमे	
407	वनवासात् प्रत्यागम्य श्रीराम: कुत्र जटानां कर्तनं कृतवान्?	नन्दीग्रामे	
408	मेघनाद: (लक्ष्मणेन सह युद्धं कुर्वन्) युद्धक्षेत्रं परित्यज्य यज्ञानुष्ठानाय कं स्थानं गतवान्?	निकुम्भिलाम्	
409	नंदिग्राम: अयोध्यायाः कस्यां दिशि स्थित: आसीत्?	पूर्वदिशि	
410	खरदूषणौ कुत्र निवसतः आस्ताम्?	दण्डकवने	
411	श्रीरामेण सीतायै वनवासे दत्ते सा कुत्र अवसत्?	वाल्मीकेः अश्रमे	
412	पञ्चवटी, यत्र श्रीरामः सीतालक्ष्मणाभ्यां समेतः वनवासकाले पर्णकुटिं कृत्वा निवसन् आसीत्, सा कस्याः नद्याः तटे आसीत्?	गोदावर्याः; गोदावरीनद्याः	
413	वनवासस्य समये श्रीरामं द्रष्टुं भरतः कं स्थानं गतवान्?	चित्रकूूटम्	
414	भरद्वाजस्य ऋषेः आश्रमः कस्याः नद्याः तीरे आसीत्?	गङ्गायमुनयोः सङ्गमे; गङ्गायमुनयोः	
415	निषादराजस्य गुहस्य निवासः कुत्र आसीत्?	शृङ्गवेरपुरम्; शृङ्गवेरपुरे	
416	सीतायाः हरणं कृत्वा रावणः तां प्रथमं कुत्र स्थितवान्?	स्वान्तःपुरे	
417	विराधः राक्षसः कुत्र निवसति स्म?	दण्डकवने; दण्डकारण्ये; दण्डके	
418	अगस्त्यऋषिः कुत्र निवसति स्म?	दण्डकवने; दण्डकारण्ये; दण्डके	
419	काजलमेघाविव कृष्णाः वानराः कस्य पर्वतस्य पृष्ठे अद्यापि दृश्यन्ते?	अञ्जनपर्वतस्य	
420	कस्यां नद्यां स्नानं कृत्वा सन्तानलोकः प्राप्यते इति विचारः अस्ति?	सरयूनद्याम्; सरयू नद्याम्; सरय्वाम्	
421	वानरयूथपतिः पनसः कस्मिन् अचलशृङ्गे वसति?	पारियात्रे	
422	प्रथमतः हनुमतः श्रीरामेण सह सम्मेलनं कस्मिन् स्थले अभवत्?	ऋष्यमूकपर्वते; ऋष्यमूके	
423	गङ्गा शिवस्य जटायाः विमुक्ता कस्मिन् स्थले पतिता?	बिन्दुसरसि	
424	सः कः पर्वतः यस्य स्वरूपं सूर्यस्य वरदानेन सुवर्णमयं अभवत्?	सुमेरुः; मेरुः; मेरुपर्वतः	
425	शिवस्य वासनं कस्मिन् अचलशृङ्गे अस्ति?	कैलासे; कैलासशृङ्गे	
426	किं वनं जनस्थानं इति कथ्यते?	दण्डकवनम्; दण्डकारण्यम्	
427	सीतायाः अन्वेषणाय सुग्रीवः वानरयूथपतिं विनतं कां दिशं प्रेषितवान्?	पूर्वदिशम्; पूर्वाम्	
428	रामशिला कस्मिन् स्थले अस्ति?	गयायाम्	
429	प्राग्ज्योतिषपुरं कस्मिन् अचले स्थितम् आसीत्?	वराहपर्वते; वराहे	
430	सीतायाः अन्वेषणाय सुग्रीवः वैद्युतिकपर्वतक्षेत्रे कं प्रेषितवान्?	हनुमन्तम्; हनूमन्तम्	
431	सीतायाः अन्वेषणाय सुग्रीवेण वृषभः कस्यां दिशि प्रेषितः ?	दक्षिणदिशि; दक्षिण दिशि; दक्षिणायाम्	
432	कस्मिन् पर्वते विश्वकर्मणा ऋषये अगस्त्याय एकं दिव्यं भवनं निर्मितं ?	कुञ्जरपर्वते; कुञ्जरे	
433	सीतायाः अन्वेषणाय सुग्रीवेण मालवदेशं कः प्रेषितः ?	विनतः	
434	सौवीरदेशे कस्य आधिपत्यं आसीत् ?	दशरथस्य	
435	इन्द्रः कस्याः दिशः लोकपालः मन्यते ?	पुर्वदिशः; पूर्वस्याः	
436	दक्षिणपूर्वदिशि कः लोकपालः मन्यते ?	अग्निः	
437	यमः कस्याः दिशः लोकपालः मन्यते ?	दक्षिणदिशः; दक्षिणस्याः	
438	कुबेरः कस्मिन् दिशि लोकपालः मन्यते ?	उत्तरदिशि; उत्तरे	
439	दक्षिणपश्चिमदिशि कः लोकपालः मन्यते ?	निरृतिः; निर्ऋतिः	
440	वरुणः कस्यां दिशि लोकपालः मन्यते ?	पश्चिमदेिशि; पश्चिमायाम्	
441	कुरु देशः कस्मिन् नदीतटस्थः आसीत् ?	शैलोदायाः	
442	ब्रह्मणः भवनं कस्मिन् पर्वते आसीत् ?	मेरुपर्वते; मेरौ	
443	वानरयूथपतिः शरभः कस्मिन् पर्वते निवसति स्म?	साल्वेयपर्वते; साल्वेये	
444	केकयदेशस्य राजधानीनाम किमासीत् ?	राजगृहम्	
445	श्रृंगवेरपुरं कस्याः नद्याः तटे स्थितम् आसीत् ?	गङ्गायाः	
446	लवपुरं केन स्थापितं आसीत् ?	लवेन	
447	वानरयूथपतिः प्रमाथी कस्मिन् पर्वते निवसति स्म ?	मन्दरे	
448	मतंगमुनेः शापभयेन वाली कं पर्वतः न गच्छति स्म?	ऋष्यमूकं पर्वतं; ऋष्यमूकं; ऋष्यमूकम्	
449	सः कः देशः आसीत् यः सुन्दरीकृतानां अश्वानां कृते प्रसिद्धः?	बाह्लीकः; कम्बोजः	
450	ऋचीकमुनेः आश्रमः कस्मिन् पर्वते आसीत् ?	भृगुतुङ्गे	
451	सीतायाः अन्वेषणाय सुग्रीवेण हनूमान् अङ्गदः च कस्यां दिशि प्रेषितौ?	दक्षिणदिशि; दक्षिणायाम्	
452	वानरयूथपतिः केसरी कस्मिन् पर्वते सन्निविष्टः आसीत्?	काञ्चनपर्वते	
453	सीतायाः अन्वेषणाय सुग्रीवः पाण्ड्यदेशं प्रति कं प्रेषितवान्?	अङ्गदम्	
454	वनवासगमनसमये श्रीरामः अयोध्यावासीनः कस्मिन् स्थले सुप्तान् त्यक्त्वा गतवान्?	शृङ्गवेरपुरे; श्रृङ्गवेरपुरे	
455	भरतः बाल्यकाले कुत्र अवसत्?	मातुलगृहे	
456	सीतायाः स्वयम्वरसमये राजा जनकः कुशध्वजं कस्याः नगर्याः आह्वयत्?	साङ्काश्याः; सांकाश्याः	
457	सीतायाः अन्वेषणाय लङ्कां सर्वप्रथमतः कः प्राप्तवान्?	हनुुमान्	
458	श्रीरामस्य जन्म कस्मिन् स्थले अभवत्?	अयोध्यायाम्	
459	हनुमता सह सीतायाः सर्वप्रथमं  कस्मिन् स्थले मेलनम् अभवत्?	अशोकवाटिकायाम्; अशोकवनिकायाम्; अशोकवने; अशोकवने 	
460	प्रतिष्ठानपुरं कस्याः नद्याः तीरे अवस्थितम्?	गङ्गायमुुनयोः सङ्गमे	
461	श्रीरामस्य मित्रं प्रतर्दनः कस्य राजा आसीत्?	काश्याः	
462	सुदामा नामकः पर्वतः कस्मिन् देशे स्थितः आसीत्?	बाह्रीकदेशे; बाह्लीके	
463	दक्षिणे स्थिते देशे चोले सीतायाः अन्वेषणं कर्तुं सुग्रीवः कम् प्रेषयामास?	अङ्गदम्	
464	सीतायाः अन्वेषणाय सुग्रीवः मगधदेशं प्रति कम् प्रेषयामास?	विनतम्	
465	श्रीरामस्य मातुः किं नाम आसीत्?	कौसल्या	
466	हनुमत: जननी का आसीत्?	अञ्जनी; अञ्जना	
467	दशरथस्य माता का आसीत्?	इन्दुमतिः	
468	रावणस्य माता का आसीत्?	कैकसी	
469	जटायोः (गृद्धस्य) माता का आसीत्?	श्येनी	
470	मन्दोदर्याः मातुः किं नाम आसीत्?	हेमा	
471	विभीषणस्य माता का आसीत्?	कैकसी	
472	खरस्य मातुः नाम किम्?	पुष्पोत्कटा	
473	दूषणस्य मातुः नाम किम्?	वाका	
474	मेघनादस्य मातुः नाम किम्?	मन्दोदरी	
475	मारीचस्य (राक्षसस्य) माता का आसीत्?	ताटका	
476	नलस्य (वानरस्य) माता का आसीत्?	घृताची	
477	लक्ष्मणस्य माता का आसीत्?	सुमित्रा	
478	महर्षेः परशुरामस्य माता का आसीत्?	रेणुका	
479	शत्रुघ्नस्य माता का आसीत्?	सुमित्रा	
480	भरतस्य माता का आसीत्?	कैकेयी	
481	अङ्गदस्य मातुः नाम किमासीत्?	तारा	
482	लवणासुरस्य माता का आसीत्?	कुम्भीनसी	
483	शतानन्दस्य (जनकस्य पुरोहितस्य) मातुः नाम किमासीत्?	अहल्या	
484	अकम्पनराक्षसस्य माता का आसीत्?	केतुमती	
485	पूरोः माता का आसीत्?	शर्मिष्ठा	
486	इन्द्रस्य मातुः नाम किमासीत्?	अदितिः	
487	अतिकायस्य (रावणस्य पुत्रस्य) माता का आसीत्?	धान्यमालिनी	
488	कुबेरस्य माता का आसीत्?	देववर्णिनी	
489	सुरसाया: मातुः नाम किमासीत्?	क्रोधवशा	
490	विराधराक्षसस्य मातुः नाम किमासीत्?	शतह्रदा	
491	महोदरराक्षसस्य माता का आसीत् ?	पुष्पोत्कटा	
492	नागानां माता का आसीत्?	सुरसा	
493	दुन्दुभिदैत्यस्य माता का आसीत्?	हेमा	
494	महर्षेः दुर्वाससः मातुः नाम किम्?	अनसूया	
495	सिंहिका राक्षसी कस्य माता आसीत्?	राहोः	
496	हनुमतः पिता कः आसीत्?	केसरी	
497	रावणस्य पिता कः आसीत्?	विश्रवाः	
498	ताटकाराक्षस्याः पितुः नाम किम्?	सुकेतुः	
499	जटायोः पिता कः आसीत्?	अरुणः	
500	जाम्बवतः पितुः नाम किम्?	गद्गदः	
501	वालिनः पिता कः आसीत् ?	ऋक्षरजः; ऋक्षरजाः	
502	सुग्रीवस्य पितुः नाम किम् आसीत् ?	ऋक्षरजः; ऋक्षरजाः	
503	खरदूषणयोः पिता कः आसीत्?	विश्रवाः	
504	नलस्य (वानरस्य) पिता कः आसीत् ?	विश्वकर्मा	
505	नीलस्य (वानरस्य) पिता कः अस्ति ?	अग्निदेवः; अग्निः	
506	राज्ञः दशरथस्य पितुः नाम किम् आसीत् ?	अजः	
507	अंगदस्य (वानरस्य) पिता कः आसीत् ?	वाली	
508	श्रीरामस्य, लक्ष्मणस्य, भरतस्य, शत्रुघ्नस्य च पिता कः आसीत् ?	दशरथः	
509	मन्दोदर्याः पितुः नाम किम् आसीत् ?	मयः; मयदानवः	
510	(सती) सुलोचनायाः पिता कः आसीत् ?	वासुकिः	
511	महर्षेः परशुरामस्य पितुः नाम किं आसीत् ?	जमदग्निः	
512	महर्षेः विश्वामित्रस्य पितुः नाम किं आसीत् ?	गाधिः	
513	सुमालिनः (राक्षसस्य) पिता कः आसीत्?	सुकेशः	
514	लवणासुरस्य पिता कः आसीत् ?	मधुुदैत्यः; मधुः	
515	शतानन्दस्य (जनकस्य पुरोहितस्य) पिता कः आसीत् ?	गौतमः	
516	महाराजस्य गाधेः पितुः नाम किम् आसीत् ?	कुशनाभः	
517	सुन्दस्य दैत्यस्य पिता कः आसीत् ?	जम्भः	
518	वानरयूथपत्युः मारीचस्य पिता कः आसीत् ?	मरीचः	
519	उल्कामुखस्य अनङ्गस्य च (वानरयोः) पिता कः आसीत् ?	अग्निः	
